{
  "schemaVersion": 1,
  "id": "gu.qiao-bu-gu",
  "type": "gu",
  "name": "悄步蛊",
  "aliases": [],
  "summary": "能够掩藏脚步声，可克制依赖听觉和脚步判断的侦察手段。",
  "status": "verified-volume-1",
  "scope": {
    "volume": 1,
    "maxChapter": 199
  },
  "attributes": {
    "品阶": "第一卷未明确",
    "类别": "隐匿",
    "第一卷记录形态": "方案提及",
    "审计批次": "第一卷蛊虫全面复核"
  },
  "facts": [
    {
      "text": "能够掩藏脚步声，可克制依赖听觉和脚步判断的侦察手段。",
      "sources": [
        70,
        138
      ]
    }
  ],
  "relations": [],
  "tags": [
    "第一卷未明确",
    "隐匿",
    "方案提及",
    "第一卷"
  ],
  "firstMention": {
    "chapterId": 70
  }
}
