{
  "schemaVersion": 1,
  "id": "gu.han-9a6d-718a-86ca",
  "type": "gu",
  "name": "驭熊蛊",
  "aliases": [],
  "summary": "能奴役普通熊兽，二转级数尚不足以控制熊类兽王。",
  "status": "verified-volume-1",
  "scope": {
    "volume": 1,
    "maxChapter": 199
  },
  "attributes": {
    "品阶": "二转",
    "类别": "奴役",
    "第一卷记录形态": "实际出现",
    "审计批次": "第一卷蛊虫全面复核"
  },
  "facts": [
    {
      "text": "能奴役普通熊兽，二转级数尚不足以控制熊类兽王。",
      "sources": [
        146
      ]
    }
  ],
  "relations": [],
  "tags": [
    "二转",
    "奴役",
    "实际出现",
    "第一卷"
  ],
  "firstMention": {
    "chapterId": 146
  }
}
