{
  "schemaVersion": 1,
  "id": "gu.huang-luo-tian-niu-gu",
  "type": "gu",
  "name": "黄骆天牛蛊",
  "aliases": [],
  "summary": "能降低体力消耗、增强持久作战能力，且没有蛮力天牛蛊的后遗症。",
  "status": "verified-volume-1",
  "scope": {
    "volume": 1,
    "maxChapter": 199
  },
  "attributes": {
    "品阶": "一转",
    "类别": "耐力增幅",
    "第一卷记录形态": "实际出现",
    "审计批次": "第一卷蛊虫全面复核"
  },
  "facts": [
    {
      "text": "能降低体力消耗、增强持久作战能力，且没有蛮力天牛蛊的后遗症。",
      "sources": [
        62,
        63
      ]
    }
  ],
  "relations": [],
  "tags": [
    "一转",
    "耐力增幅",
    "实际出现",
    "第一卷"
  ],
  "firstMention": {
    "chapterId": 62
  }
}
