{
  "schemaVersion": 1,
  "id": "gu.shui-tun-gu",
  "type": "gu",
  "name": "水豚蛊",
  "aliases": [],
  "summary": "白家蛊师白重水持有的蛊虫，第一卷在会盟人物介绍中点名。",
  "status": "verified-volume-1",
  "scope": {
    "volume": 1,
    "maxChapter": 199
  },
  "attributes": {
    "品阶": "第一卷未明确",
    "类别": "第一卷未明确",
    "第一卷记录形态": "人物介绍提及",
    "审计批次": "第一卷蛊虫全面复核"
  },
  "facts": [
    {
      "text": "白家蛊师白重水持有的蛊虫，第一卷在会盟人物介绍中点名。",
      "sources": [
        124
      ]
    }
  ],
  "relations": [],
  "tags": [
    "第一卷未明确",
    "人物介绍提及",
    "第一卷"
  ],
  "firstMention": {
    "chapterId": 124
  }
}
