{
  "schemaVersion": 1,
  "id": "gu.han-515c-7387-82b1",
  "type": "gu",
  "name": "兜率花",
  "aliases": [],
  "summary": "能储存元石和其他物品的三转草蛊，方源从地下虫洞选取并使用。",
  "status": "verified-volume-1",
  "scope": {
    "volume": 1,
    "maxChapter": 199
  },
  "attributes": {
    "品阶": "三转",
    "类别": "储物",
    "第一卷记录形态": "实际出现",
    "审计批次": "第一卷蛊虫全面复核"
  },
  "facts": [
    {
      "text": "能储存元石和其他物品的三转草蛊，方源从地下虫洞选取并使用。",
      "sources": [
        160,
        161
      ]
    }
  ],
  "relations": [],
  "tags": [
    "三转",
    "储物",
    "实际出现",
    "第一卷"
  ],
  "firstMention": {
    "chapterId": 160
  }
}
