{
  "schemaVersion": 1,
  "id": "gu.han-97f3-6d6a-86ca",
  "type": "gu",
  "name": "音浪蛊",
  "aliases": [],
  "summary": "以声音振动空气形成无形推力，第一卷中一度被误判为雷啸蛊。",
  "status": "verified-volume-1",
  "scope": {
    "volume": 1,
    "maxChapter": 199
  },
  "attributes": {
    "品阶": "第一卷未明确",
    "类别": "音道攻击",
    "第一卷记录形态": "实际出现",
    "审计批次": "第一卷蛊虫全面复核"
  },
  "facts": [
    {
      "text": "以声音振动空气形成无形推力，第一卷中一度被误判为雷啸蛊。",
      "sources": [
        150
      ]
    }
  ],
  "relations": [],
  "tags": [
    "第一卷未明确",
    "音道攻击",
    "实际出现",
    "第一卷"
  ],
  "firstMention": {
    "chapterId": 150
  }
}
