{
  "schemaVersion": 1,
  "id": "gu.han-8840-6cb3-87d2",
  "type": "gu",
  "name": "血河蟒",
  "aliases": [
    "血蟒蛊"
  ],
  "summary": "古月一代操纵的五转血蟒，凶残难驯并以血为食。",
  "status": "verified-volume-1",
  "scope": {
    "volume": 1,
    "maxChapter": 199
  },
  "attributes": {
    "品阶": "五转",
    "类别": "血道攻击",
    "第一卷记录形态": "实际出现",
    "审计批次": "第一卷蛊虫全面复核"
  },
  "facts": [
    {
      "text": "古月一代操纵的五转血蟒，凶残难驯并以血为食。",
      "sources": [
        184,
        185
      ]
    }
  ],
  "relations": [],
  "tags": [
    "五转",
    "血道攻击",
    "实际出现",
    "第一卷"
  ],
  "firstMention": {
    "chapterId": 117
  }
}
