{
  "schemaVersion": 1,
  "id": "gu.bai-yu-gu",
  "type": "gu",
  "name": "白玉蛊",
  "aliases": [],
  "summary": "由白豕蛊和玉皮蛊合炼而成，保留并强化玉皮蛊的防御能力。",
  "status": "verified-volume-1",
  "scope": {
    "volume": 1,
    "maxChapter": 199
  },
  "attributes": {
    "品阶": "二转",
    "类别": "防御",
    "第一卷记录形态": "配方提及与实际炼成",
    "审计批次": "第一卷蛊虫全面复核"
  },
  "facts": [
    {
      "text": "由白豕蛊和玉皮蛊合炼而成，保留并强化玉皮蛊的防御能力。",
      "sources": [
        64,
        99
      ]
    }
  ],
  "relations": [],
  "tags": [
    "二转",
    "防御",
    "配方提及与实际炼成",
    "第一卷"
  ],
  "firstMention": {
    "chapterId": 64
  }
}
