{
  "schemaVersion": 1,
  "id": "gu.song-zhen-gu",
  "type": "gu",
  "name": "松针蛊",
  "aliases": [],
  "summary": "古月青书使用的木行蛊，可将头发化作松针进行范围攻击。",
  "status": "verified-volume-1",
  "scope": {
    "volume": 1,
    "maxChapter": 199
  },
  "attributes": {
    "品阶": "第一卷未明确",
    "类别": "木道攻击",
    "第一卷记录形态": "实际出现",
    "审计批次": "第一卷蛊虫全面复核"
  },
  "facts": [
    {
      "text": "古月青书使用的木行蛊，可将头发化作松针进行范围攻击。",
      "sources": [
        104,
        141
      ]
    }
  ],
  "relations": [],
  "tags": [
    "第一卷未明确",
    "木道攻击",
    "实际出现",
    "第一卷"
  ],
  "firstMention": {
    "chapterId": 104
  }
}
