{
  "schemaVersion": 1,
  "id": "gu.liu-ying-cun-sheng-gu",
  "type": "gu",
  "name": "留影存声蛊",
  "aliases": [],
  "summary": "能够记录并回放影像与声音；花酒行者用它在石壁中留下传承影像。",
  "status": "verified-volume-1",
  "scope": {
    "volume": 1,
    "maxChapter": 199
  },
  "attributes": {
    "品阶": "三转",
    "类别": "信息记录",
    "第一卷记录形态": "实际出现",
    "审计批次": "第一卷蛊虫全面复核"
  },
  "facts": [
    {
      "text": "能够记录并回放影像与声音；花酒行者用它在石壁中留下传承影像。",
      "sources": [
        16,
        156
      ]
    }
  ],
  "relations": [],
  "tags": [
    "三转",
    "信息记录",
    "实际出现",
    "第一卷"
  ],
  "firstMention": {
    "chapterId": 16
  }
}
