{
  "schemaVersion": 1,
  "id": "gu.han-5bff-86ca",
  "type": "gu",
  "name": "寿蛊",
  "aliases": [
    "百年寿蛊",
    "千年寿蛊"
  ],
  "summary": "消耗后可从根本上增加寿命；第一卷提到八十年、百年与千年等不同寿数。",
  "status": "verified-volume-1",
  "scope": {
    "volume": 1,
    "maxChapter": 199
  },
  "attributes": {
    "品阶": "品阶随个体而异",
    "类别": "寿命",
    "第一卷记录形态": "传说与修行知识提及",
    "审计批次": "第一卷蛊虫全面复核"
  },
  "facts": [
    {
      "text": "消耗后可从根本上增加寿命；第一卷提到八十年、百年与千年等不同寿数。",
      "sources": [
        38,
        126
      ]
    }
  ],
  "relations": [],
  "tags": [
    "品阶随个体而异",
    "寿命",
    "传说与修行知识提及",
    "第一卷"
  ],
  "firstMention": {
    "chapterId": 38
  }
}
