{
  "schemaVersion": 1,
  "id": "gu.shuang-lin-yue-gu",
  "type": "gu",
  "name": "霜霖月蛊",
  "aliases": [],
  "summary": "月芒蛊的一条晋升路线，月刃带有寒气，可使目标行动迟缓。",
  "status": "verified-volume-1",
  "scope": {
    "volume": 1,
    "maxChapter": 199
  },
  "attributes": {
    "品阶": "第一卷未明确",
    "类别": "月道与冰道攻击",
    "第一卷记录形态": "配方提及",
    "审计批次": "第一卷蛊虫全面复核"
  },
  "facts": [
    {
      "text": "月芒蛊的一条晋升路线，月刃带有寒气，可使目标行动迟缓。",
      "sources": [
        156
      ]
    }
  ],
  "relations": [],
  "tags": [
    "第一卷未明确",
    "月道与冰道攻击",
    "配方提及",
    "第一卷"
  ],
  "firstMention": {
    "chapterId": 156
  }
}
