{
  "schemaVersion": 1,
  "id": "gu.han-96f7-76fe-86ca",
  "type": "gu",
  "name": "雷盾蛊",
  "aliases": [
    "雷壳蛊"
  ],
  "summary": "可形成半圆形电光护盾，寄生于狂电狼身上；正文同一场景亦写作雷壳蛊。",
  "status": "verified-volume-1",
  "scope": {
    "volume": 1,
    "maxChapter": 199
  },
  "attributes": {
    "品阶": "三转",
    "类别": "防御",
    "第一卷记录形态": "野兽寄生与实际出现",
    "审计批次": "第一卷蛊虫全面复核"
  },
  "facts": [
    {
      "text": "可形成半圆形电光护盾，寄生于狂电狼身上；正文同一场景亦写作雷壳蛊。",
      "sources": [
        167,
        168
      ]
    }
  ],
  "relations": [],
  "tags": [
    "三转",
    "防御",
    "野兽寄生与实际出现",
    "第一卷"
  ],
  "firstMention": {
    "chapterId": 167
  }
}
