{
  "schemaVersion": 1,
  "id": "gu.han-5929-9b54-5c38",
  "type": "gu",
  "name": "天魔尸",
  "aliases": [],
  "summary": "与血鬼尸并列的五大飞僵之一，第一卷仅点名。",
  "status": "verified-volume-1",
  "scope": {
    "volume": 1,
    "maxChapter": 199
  },
  "attributes": {
    "品阶": "五转飞僵分支",
    "类别": "僵尸变化",
    "第一卷记录形态": "系列名录提及",
    "审计批次": "第一卷蛊虫全面复核"
  },
  "facts": [
    {
      "text": "与血鬼尸并列的五大飞僵之一，第一卷仅点名。",
      "sources": [
        185
      ]
    }
  ],
  "relations": [],
  "tags": [
    "五转飞僵分支",
    "僵尸变化",
    "系列名录提及",
    "第一卷"
  ],
  "firstMention": {
    "chapterId": 185
  }
}
